<?xml version="1.0" encoding="UTF-8"?>
<!--
To change this license header, choose License Headers in Project Properties.
To change this template file, choose Tools | Templates
and open the template in the editor.
-->


<RootElement
    xmlns:xsi='http://www.w3.org/2001/XMLSchema-instance'
    xsi:noNamespaceSchemaLocation='facultyInfo.xsd'>
    <Name>
        <FName></FName>
        <MName></MName>
        <LName></LName>
        <Age>12</Age>
    </Name>
    <DEP>
        <FName></FName>
        <MName></MName>
        <LName></LName>
        <Age>20</Age>
    </DEP>

</RootElement>
